{
  "schemaVersion": 1,
  "taskId": "ED-PARITY-009",
  "acceptance": ["ED-PARITY-009-A1", "ED-PARITY-009-A2", "ED-PARITY-009-A3"],
  "scenarioId": "CW-SEARCH-003",
  "fixture": {
    "files": [{"path": "qa-ui-auto-report/parity008-009-native-final/run-20260927-190917-170406100/native-workspaces/TC-IDE-PARITY-009-03-vl3pdoym/StructuralTarget.java", "sha256": "aff8e9cb3ff6646fa40dbe4308d5bc14fef7aff3c3d23ef8ec977c7873dc6727"}],
    "contentSource": "structural_search_java fixture shared byte-for-byte by browser and native runs; IDEA summary records the same positive/negative shape but its original fixture bytes are unavailable",
    "rootAlias": "F2 StructuralTarget.java; IDEA byte identity unverified",
    "initialState": {"dirty": false, "onDisk": true}
  },
  "settings": {
    "keymap": {"name": "IDEA Windows default / Taomni Windows", "bindings": [{"actionName": "Structural Search in Taomni", "keys": ["Mod+Shift+Alt+S"]}]},
    "editor": {"ideaTheme": "dark", "taomniTheme": "light", "ideaClientWidth": 1920, "ideaClientHeight": 1080},
    "language": "Java", "jdk": "IDEA project JDK not configured in original sample; Taomni native tree-sitter does not require a JDK", "locale": "en-US"
  },
  "steps": [
    {"stepId": "S1", "actionName": "Open Structural Search with the Java println template", "menuPath": "Search Structurally / Structural Search action", "input": "System.out.println($arg$);", "preState": "StructuralTarget.java open", "observedFields": ["focus", "results"]},
    {"stepId": "S2", "actionName": "Search In Project without a modifier", "keys": ["mouse"], "input": "System.out.println($arg$);", "preState": "S1 complete", "observedFields": ["results", "selection"]},
    {"stepId": "S3", "actionName": "Set arg Text to 42 and search", "keys": ["mouse"], "input": "42", "preState": "S2 complete", "observedFields": ["results", "selection"]},
    {"stepId": "S4", "actionName": "Set arg Text to 999 and search", "keys": ["mouse"], "input": "999", "preState": "S3 complete", "observedFields": ["results"]},
    {"stepId": "S5", "actionName": "Navigate a result and close the search", "keys": ["mouse", "Escape"], "input": null, "preState": "Search results visible", "observedFields": ["focus", "selection", "recovery"]},
    {"stepId": "S6", "actionName": "Compare matching-state visual geometry", "keys": ["mouse"], "input": null, "preState": "Search results and empty state captured", "observedFields": ["results"]}
  ],
  "idea": {
    "version": "2026.2.2", "buildNumber": "IU-262.10315.125", "edition": "Ultimate", "os": "Windows 11 remote desktop",
    "sampledAt": "2026-09-27T15:45:00+08:00", "operator": "reference-package desktop sampling; valid s04/s12/s13/s45/s47/s56/s57/s39 states summarized in the linked record",
    "settingsSnapshot": {"theme": "dark", "client": "1920x1080 at 96 DPI", "projectJdkConfigured": false},
    "artifacts": [{"path": "docs-feature/code-workspace-idea-parity/references/ed-parity-008-009-reference.md", "sha256": "5b08f4e55b1ab51f697db739ecec6a9fc81114900a7dbe6866e8bfba47a0aede", "type": "reference-summary", "acquisition": "read-only review of valid 2026-09-27 IDEA sample notes; original screenshots absent from this checkout"}],
    "observations": [
      {"stepId": "S1", "status": "observed", "focus": "dedicated Structural Search tool window", "results": [{"label": "Java template editor, variable modifiers and scope picker"}]},
      {"stepId": "S2", "status": "observed", "results": [{"label": "3 results grouped by class, method and location; false positives excluded"}]},
      {"stepId": "S3", "status": "observed", "results": [{"label": "Text=42 yields only System.out.println(42)"}]},
      {"stepId": "S4", "status": "observed", "results": []},
      {"stepId": "S5", "status": "observed", "recovery": "Result navigation highlights source; close returns to editor"},
      {"stepId": "S6", "status": "not-run", "reason": "The valid s-series screenshot originals and exact fixture bytes named in the summary are missing, so visual geometry cannot be independently reviewed."}
    ]
  },
  "taomni": {
    "head": "a8e9fd640fd3d3795db26822bd49a32c232db3a2",
    "sourceIdentity": {"sourceTreeHash": "e8895765c1645136706a3650672108d182f964d0e3aa25a16b3121f504a0ab21", "sourceDirty": true},
    "qaBuildIdentity": "com.taomni.app.qa debug binary sha256:2c6b71cde97de6e9ecfb2ac4f316c30cb924911e343eb8a2b0a8a2f998058c33",
    "os": "Windows", "webview": "WebView2 native; Chromium browser case", "provider": {"id": "tree-sitter-java", "version": "0.23.5"},
    "mode": "browser TC-IDE-PARITY-009-01/02/04 and native TC-IDE-PARITY-009-03",
    "summary": {"path": "qa-ui-auto-report/parity008-009-native-final/run-20260927-190917-170406100/summary.json", "sha256": "efb4aae615aee1d568f1bb7d3fec37dc91f4d4eea19fcec32a3dd33948172db7"},
    "receipt": {"path": "qa-ui-auto-report/parity008-009-native-final/run-20260927-190917-170406100/runner_receipt.json", "sha256": "e6a41b3a89189e845cfa92a256b7b6d2b446ae54f3a42507682b81062a99422a"},
    "observations": [
      {"stepId": "S1", "status": "observed", "focus": "Structural Search bottom dock", "results": [{"label": "Java pattern input, Text arg input and In Project scope"}]},
      {"stepId": "S2", "status": "observed", "results": [{"label": "3 AST results at lines 3, 4 and 5; real Tauri IPC reports tree-sitter-java"}]},
      {"stepId": "S3", "status": "observed", "results": [{"label": "Text=42 leaves one result at line 4"}]},
      {"stepId": "S4", "status": "observed", "results": [], "recovery": "Ready empty state, distinct from Unavailable"},
      {"stepId": "S5", "status": "observed", "focus": "Code Workspace editor", "recovery": "Result row navigates/highlights; Escape closes without changing Java file SHA"},
      {"stepId": "S6", "status": "observed", "results": [{"label": "Browser result screenshot and native close screenshot retained"}]}
    ]
  },
  "observations": [
    {"stepId": "S1", "status": "different", "idea": "Dedicated Structural Search tool window with full modifier controls", "taomni": "Bottom dock with Java pattern and Text arg filter", "linkedAcceptance": ["ED-PARITY-009-A2"]},
    {"stepId": "S2", "status": "matched", "idea": "Three AST matches, excluding comment/string and print/err", "taomni": "Three AST matches, excluding comment/string and print/err", "linkedAcceptance": ["ED-PARITY-009-A1", "ED-PARITY-009-A2"]},
    {"stepId": "S3", "status": "matched", "idea": "Text=42 yields one call", "taomni": "Text=42 yields one call", "linkedAcceptance": ["ED-PARITY-009-A1", "ED-PARITY-009-A2"]},
    {"stepId": "S4", "status": "matched", "idea": "Text=999 yields no match", "taomni": "Text=999 yields a ready empty state", "linkedAcceptance": ["ED-PARITY-009-A1", "ED-PARITY-009-A2"]},
    {"stepId": "S5", "status": "different", "idea": "Class to method to location tree and source highlight; close returns to editor", "taomni": "File to line tree and source selection; Escape closes dock", "linkedAcceptance": ["ED-PARITY-009-A2", "ED-PARITY-009-A3"]},
    {"stepId": "S6", "status": "not-compared", "idea": null, "taomni": "Light bottom dock screenshot available", "linkedAcceptance": ["ED-PARITY-009-A2"]}
  ],
  "deltas": [
    {"field": "interaction.searchContainer", "ideaValue": "dedicated tool window", "taomniValue": "bottom dock", "classification": "confirmed-gap", "linkedAcceptance": ["ED-PARITY-009-A2"], "explanation": "Both offer pattern, Text modifier and project scope, but opening and closing use different surfaces.", "disposition": "recorded interaction difference; first Java adapter remains scoped to the tested flow"},
    {"field": "results.hierarchy", "ideaValue": "class / method / location", "taomniValue": "file / line", "classification": "confirmed-gap", "linkedAcceptance": ["ED-PARITY-009-A2"], "explanation": "Taomni results remain navigable and highlighted but do not render IDEA's class/method grouping.", "disposition": "recorded presentation gap; no full UI parity claim"},
    {"field": "visual.match", "ideaValue": "s-series originals unavailable", "taomniValue": "browser and native screenshots present, light theme", "classification": "environment", "linkedAcceptance": ["ED-PARITY-009-A2"], "explanation": "The IDEA originals and byte manifest are absent, and the source screenshots were taken at a different theme and client size.", "disposition": "visual and exact fixture equivalence unverified; no matched claim"}
  ],
  "verdict": {"state": "unverified", "reason": "The IDEA sample summary and current Taomni runs support 3/1/0 behavior, navigation and close, while the dedicated-window and result-tree interactions differ. The missing IDEA originals prevent a visual review and exact fixture comparison, so S6 remains unverified."},
  "ceiling": {"capability": "first Java println structural pattern, Text arg filter, file/workspace scope, results navigation and typed unavailable", "fixture": "F2-equivalent StructuralTarget.java; browser/native Taomni bytes identical, IDEA bytes unverified", "provider": "native tree-sitter-java 0.23.5; browser Lezer Java", "platform": "Windows/WebView2; macOS and Linux native unverified", "level": "L2"},
  "artifacts": [
    {"path": "docs-feature/code-workspace-idea-parity/references/ed-parity-008-009-reference.md", "sha256": "5b08f4e55b1ab51f697db739ecec6a9fc81114900a7dbe6866e8bfba47a0aede", "type": "reference-summary", "acquisition": "read-only IDEA 2026.2.2 sample summary"},
    {"path": "qa-ui-auto-report/parity008-009-browser-platform-final/run-20260927-190932-431068500/summary.json", "sha256": "1b6844816093eedf6bf5ec8b39ca98002fdb08e1fd69f317119b36881caed59e", "type": "qa-summary", "acquisition": "Windows browser runner, five selected passes"},